三味線,しゃみせん,three-stringed Japanese guitar,JLPT_1 JLPT,s_z^^gPG!F,"กีตาร์ญี่ปุ่นสามสาย, ซามิเซ็น, เครื่องดนตรีญี่ปุ่น, พิณสามสาย"
斜面,しゃめん,"slope, slanting surface, bevel",JLPT_1 JLPT,x+=N.j3d7a,"ความลาดเอียง, พื้นผิวเอียง, มุมเอียง, ทางลาด"
砂利,じゃり,"gravel, ballast, pebbles",JLPT_1 JLPT,ATQMr:.4bz,"กรวด หินบัลลาสต์ หินก้อนเล็ก, หินกรวด, ก้อนกรวด, หินโรยทาง"
洒落る,しゃれる,"to joke, to play on words; stylish",JLPT_1 JLPT,H%!QFip;AM,"พูดเล่น, เล่นคำ; มีสไตล์, ขำขัน, มีรสนิยม"
ジャンパー,ジャンパー,"jacket, jumper",JLPT_1 JLPT,"n,_jvSzMfG","เสื้อแจ็คเก็ต, เสื้อกันหนาว, เสื้อคลุม, เสื้อนอก"
ジャンプ,ジャンプ,jump,JLPT_1 JLPT,pw$gcH64r%,"กระโดด, โดด, เด้ง, พุ่งตัว"
ジャンボ,ジャンボ,jumbo,JLPT_1 JLPT,uk]{9`9Xq{,"จัมโบ้, ใหญ่พิเศษ, ขนาดใหญ่, มหึมา"
ジャンル,ジャンル,genre,JLPT_1 JLPT,c5niOf<?L8,"ประเภท, ชนิด, หมวดหมู่, แนว"
主,しゅ,"owner, master, god",JLPT_1 JLPT,tZY2oe0@.s,"เจ้าของ, นายท่าน, พระเจ้า, ประธาน"
種,しゅ,seed; variety,JLPT_1 JLPT,rY$n|JRb)Y,"เมล็ดพันธุ์; พันธุ์, เมล็ด, ชนิด, สายพันธุ์"
私有,しゆう,private ownership,JLPT_1 JLPT,jZOSWJzMsO,"กรรมสิทธิ์ส่วนบุคคล, การครอบครองส่วนตัว, ทรัพย์สินส่วนตัว, เอกชน"
～宗,～しゅう,sect,JLPT_1 JLPT,cpa^uYdTpm,"นิกาย, ศาสนา, ลัทธิ, สาขา"
収益,しゅうえき,"earnings, proceeds, returns",JLPT_1 JLPT,u?TiI-~;B#,"รายได้, ผลพลอยได้, ผลตอบแทน, กำไร"
修学,しゅうがく,learning,JLPT_1 JLPT,bPtmF5tna#,"การเรียนรู้, การศึกษา, การเล่าเรียน, การศึกษาเล่าเรียน"
周期,しゅうき,"cycle, period",JLPT_1 JLPT,CsG?_1Ru~6,"รอบ, ช่วงเวลา, วงจร, ระยะเวลา"
衆議院,しゅうぎいん,"Lower House, House of Representatives",JLPT_1 JLPT,tTQG>y9]$G,"สภาล่าง สภาผู้แทนราษฎร, ส.ส., รัฐสภา, สภาประชาชน"
就業,しゅうぎょう,"employment, starting work",JLPT_1 JLPT,cF>5iCVH#I,"การจ้างงาน การเริ่มต้นทำงาน, การทำงาน, การมีงานทำ, การประกอบอาชีพ"
従業員,じゅうぎょういん,"employee, worker",JLPT_1 JLPT,e0Gyloi?1+,"พนักงาน, ลูกจ้าง, ผู้ปฏิบัติงาน, คนงาน"
集計,しゅうけい,"totalization, aggregate",JLPT_1 JLPT,s4<5~0hL>(,"ผลรวม, รวมทั้งหมด, ยอดรวม"
襲撃,しゅうげき,"attack, charge, raid",JLPT_1 JLPT,ogO5j2R_;R,"โจมตี, บุก, จู่โจม, บุกรุก"
収支,しゅうし,income and expenditure,JLPT_1 JLPT,kLuRkT404Z,"รายรับและรายจ่าย, รายได้รายจ่าย, การเงิน, การทำบัญชี"
終始,しゅうし,from beginning to end; consistent(ly),JLPT_1 JLPT,b9XF3_Vc&-,"ตั้งแต่ต้นจนจบ; อย่างสม่ำเสมอ, ตลอดมา, โดยตลอด, ไม่เปลี่ยนแปลง"
修士,しゅうし,Masters degree program,JLPT_1 JLPT,eySOZRKm#K,"หลักสูตรปริญญาโท, ปริญญาโท, มหาบัณฑิต, การศึกษาปริญญาโท"
従事,じゅうじ,"engaging, pursuing, following",JLPT_1 JLPT,kZT/egI[mV,"มีส่วนร่วม, ไล่ตาม, ติดตาม, ประกอบอาชีพ"
終日,しゅうじつ,all day,JLPT_1 JLPT,AR^6lmvOwg,"ตลอดทั้งวัน, ตลอดวัน, ทั้งวัน, เต็มวัน"
充実,じゅうじつ,"fullness, perfection",JLPT_1 JLPT,tGa!Bufhy/,"ความสมบูรณ์ ความสมบูรณ์แบบ, ครบถ้วน, เต็มเปี่ยม, บริบูรณ์"
収集,しゅうしゅう,"gathering up, collection",JLPT_1 JLPT,"g+wGkM,J!.","การรวบรวม, การเก็บสะสม, การสะสม, รวบรวม"
十字路,じゅうじろ,crossroads,JLPT_1 JLPT,M-P484f.3r,"ทางแยก, สี่แยก, แยกถนน, ทางตัดกัน"
執着,しゅうじゃく,"attachment, adhesion, tenacity",JLPT_1 JLPT,u`m`$IGAEz,"การยึดติด, การเกาะติด, ความเหนียวแน่น, การผูกพัน"
執着,しゅうちゃく,"attachment, adhesion, tenacity",JLPT_1 JLPT,k5L#!.1c@y,"การยึดติด, การเกาะติด, ความเหนียวแน่น, การยึดมั่น"
柔軟,じゅうなん,flexible,JLPT_1 JLPT,o$JEWneOMf,"ยืดหยุ่นได้, อ่อนตัว, คล่องตัว, ปรับตัวได้"
重複,じゅうふく,"duplication, repetition, overlapping",JLPT_1 JLPT,xsR4^tk;%3,"การทำซ้ำ การทับซ้อน, ซ้ำซ้อน, การคัดลอก, การทวนซ้ำ"
収容,しゅうよう,accommodation; seating; custody,JLPT_1 JLPT,e@q$+H3N_E,"ที่พัก; ที่นั่ง; การดูแลรักษา, การรองรับ, การจัดที่พัก, การกักกัน"
従来,じゅうらい,"up to now, so far, traditional",JLPT_1 JLPT,m&r$7kIG&x,"จนถึงปัจจุบันนี้ ยังคงเป็นแบบดั้งเดิม, เดิมที, ตั้งแต่ก่อน, เป็นปกติ"
守衛,しゅえい,"security guard, doorkeeper",JLPT_1 JLPT,e^0%h@~lt8,"พนักงานรักษาความปลอดภัย, พนักงานเฝ้าประตู, ยาม, รปภ."
主演,しゅえん,"starring, playing the leading part",JLPT_1 JLPT,n]D<c|Caow,"แสดงนำ, รับบทนำ, ตัวเอก, นักแสดงนำ"
主観,しゅかん,"subjectivity, subject, ego",JLPT_1 JLPT,lW5DbL!{A5,"ความเป็นอัตวิสัย, ตัวตน, อัตตา, ความคิดส่วนตัว"
修行,しゅぎょう,"pursuit of knowledge, training, ascetic practice",JLPT_1 JLPT,KirESaOr*_,"การแสวงหาความรู้ การฝึกฝน การปฏิบัติทางบำเพ็ญตบะ, การฝึกอบรม, การฝึกตน, การบำเพ็ญเพียร"
塾,じゅく,after-school (cram) school,JLPT Intermediate_Japanese JLPT_1 Intermediate_Japanese_Ln.5 Genki_Ln.22 Genki,r6*vU;-fx(,"โรงเรียนกวดวิชาหลังเลิกเรียน, สถาบันกวดวิชา, ที่เรียนพิเศษ, โรงเรียนเสริม"
祝賀,しゅくが,"celebration, congratulations",JLPT_1 JLPT,wRzD+</l;5,"การเฉลิมฉลอง, การแสดงความยินดี, งานฉลอง, พิธีเฉลิมฉลอง"
宿命,しゅくめい,"fate, destiny, predestination",JLPT_1 JLPT,BFNKk^{M1j,"โชคชะตา, พรหมลิขิต, ชะตากรรม"
手芸,しゅげい,handicrafts,JLPT_1 JLPT,QuReZ-t?cb,"งานหัตถกรรม, งานฝีมือ, หัตถศิลป์, ศิลปหัตถกรรม"
主権,しゅけん,sovereignty,JLPT_1 JLPT,bc]8:XVC+v,"อำนาจอธิปไตย, อธิปไตย, เอกราช, อำนาจสูงสุด"
主催,しゅさい,"organization, sponsorship, to host",JLPT_1 JLPT,Az?/+|wSuL,"องค์กร, ผู้สนับสนุน, เพื่อเป็นเจ้าภาพ, ผู้จัดงาน"
取材,しゅざい,"coverage, collecting data",JLPT_1 JLPT,ALv+C0}[Uy,"ความครอบคลุม การเก็บรวบรวมข้อมูล, การทำข่าว, การรวบรวมข่าว, การสัมภาษณ์"
趣旨,しゅし,"object, meaning",JLPT_1 JLPT,r#aoMGQ7ru,"วัตถุ ความหมาย, จุดประสงค์, เจตนารมณ์, สาระสำคัญ"
種々,しゅじゅ,variety,JLPT_1 JLPT,L$zP;w1Dds,"ความหลากหลาย, หลายชนิด, สารพัด, นานาชนิด"
主食,しゅしょく,staple food,JLPT_1 JLPT,Ff{n(i0=[l,"อาหารหลัก, อาหารประจำ, อาหารพื้นฐาน, ข้าวปลาอาหาร"
主人公,しゅじんこう,protagonist,JLPT_1 JLPT,Ci-hQYEll,"ตัวเอก, พระเอก, ตัวนำ, ตัวละครหลัก"
主体,しゅたい,"subject, main constituent",JLPT_1 JLPT,"wk,7:5Ulq:","หัวข้อ, องค์ประกอบหลัก, แก่น, ประเด็นหลัก"
主題,しゅだい,"subject, theme, motif",JLPT_1 JLPT,t4<KTH8w{.,"หัวข้อ, แก่นเรื่อง, ลวดลาย, ประเด็น"
出演,しゅつえん,"leading performer, stage appearance",JLPT_1 JLPT,B>+JLE{F%w,"นักแสดงนำ, การปรากฏตัวบนเวที, การแสดง, การขึ้นแสดง"
出血,しゅっけつ,bleeding,JLPT_1 JLPT,jt7Tvjw[T<,"เลือดออก, เลือดไหล, ตกเลือด, เสียเลือด"
出現,しゅつげん,"appearance, arrival",JLPT_1 JLPT,et$R3oC-m[,"ลักษณะที่ปรากฏ การมาถึง, การปรากฏ, การแสดงตัว, การโผล่มา"
出産,しゅっさん,childbirth,JLPT_1 Intermediate_Japanese_Ln.14 JLPT Intermediate_Japanese,CT4;+h>Ai7,"การคลอดบุตร, การเกิด, การคลอด, การให้กำเนิด"
出社,しゅっしゃ,come to work,JLPT_1 JLPT,Gd$MA{t_:M,"มาทำงาน, เข้าทำงาน, ไปทำงาน, เริ่มทำงาน"
出生,しゅっしょう,birth,JLPT_1 JLPT,CwJVE%al3B,"การเกิด, กำเนิด, การคลอด, การถือกำเนิด"
出生,しゅっせい,birth,JLPT_1 JLPT,cV$*)i2b6%,"การเกิด, กำเนิด, การคลอด, การถือกำเนิด"
微量,びりょう,"minuscule amount, extremely small quantity",JLPT_1 JLPT,Ix21c!hl+{,"ปริมาณเล็กน้อยมาก ปริมาณที่น้อยมาก, จำนวนน้อยนิด, น้อยที่สุด, นิดเดียว"
昼飯,ひるめし,lunch (mid-day meal),JLPT_1 JLPT,B4a{kV3{l&,"อาหารกลางวัน (มื้ออาหารช่วงกลางวัน), มื้อเที่ยง, ข้าวเที่ยง, มื้อกลางวัน"
比例,ひれい,proportion,JLPT_1 JLPT,u^9gz.!&Uk,"สัดส่วน, อัตราส่วน, ความสัมพันธ์, สัดส่วนกัน"
疲労,ひろう,"fatigue, weariness",JLPT_1 JLPT,m.KXL51O8=,"ความเหนื่อยล้า ความอ่อนเพลีย, เหนื่อย, อ่อนล้า, เพลีย"
敏感,びんかん,"sensibility, susceptibility, sensitive (to)",JLPT_1 JLPT,i]}jt3Q.(f,"ความอ่อนไหว, ไวต่อสิ่งเร้า, ไวต่อความรู้สึก"
貧困,ひんこん,"poverty, lack",JLPT_1 JLPT,xy9G9E{K5M,"ความยากจน การขาดแคลน, ยากไร้, ขัดสน, อัตคัด"
品質,ひんしつ,quality,JLPT_1 JLPT,v)0nMB=(Mu,"คุณภาพ, มาตรฐาน, ระดับ, คุณสมบัติ"
貧弱,ひんじゃく,"poor, meager, insubstantial",JLPT_1 JLPT,"AT#enW$Yd,","ยากจน น้อยนิด ไม่มีสาระสำคัญ, ด้อยคุณภาพ, ขาดแคลน, ไม่แข็งแรง"
品種,ひんしゅ,"breed, type, variety",JLPT_1 JLPT,K%9{]!|f1(,"สายพันธุ์, ประเภท, พันธุ์, ชนิด"
ヒント,ヒント,hint,JLPT_1 JLPT,l]_+v%b&%R,"คำใบ้, ข้อแนะนำ, แนวทาง, สิ่งบอกใบ้"
頻繁,ひんぱん,frequency,JLPT_1 JLPT,D{nW!<u7<*,"ความถี่, บ่อยครั้ง, ถี่, ซ้ำๆ"
貧乏,びんぼう,"poverty, destitute, poor",JLPT_1 JLPT,KjBzaYHZW.,"ความยากจน, คนขัดสน, ยากไร้"
ファイト,ファイト,fight,JLPT_1 JLPT,"C?{V+<,&x0","ต่อสู้, สู้, ทะเลาะ, ปะทะ"
ファイル,ファイル,file; portfolio,JLPT_1 Genki_Ln.16 JLPT Genki,srC<dgokBJ,"ไฟล์; แฟ้มสะสมผลงาน, แฟ้ม, เอกสาร, แฟ้มเอกสาร"
ファン,ファン,fan,JLPT_1 JLPT,hsy0ORScG&,"พัดลม, แฟนคลับ, ผู้ชื่นชอบ, กองเชียร์"
不意,ふい,"sudden, abrupt, unexpected",JLPT_1 JLPT,xgYlO*O}d~,"ฉับพลัน กะทันหัน ไม่คาดคิด, ปุบปับ, โดยไม่ตั้งใจ, ทันทีทันใด"
フィルタ,フィルタ,filter,JLPT_1 JLPT,jmKbIb6QcW,"กรอง, ตัวกรอง, การกรอง, แยกสิ่งปนเปื้อน"
封,ふう,seal,JLPT_1 JLPT,iHGcq7T#S>,"ผนึก, ประทับตรา, ปิดผนึก, ตรึง"
封鎖,ふうさ,"blockade, freezing (funds)",JLPT_1 JLPT,Ae_x+Wt0^{,"การปิดล้อม การอายัด (เงินทุน), การกักกัน, การปิดกั้น, การอายัดทรัพย์"
風車,ふうしゃ,windmill,JLPT_1 JLPT,m${YvIujFj,"กังหันลม, ระหัดลม, พัดลม, เครื่องกังหัน"
風習,ふうしゅう,custom,JLPT_1 JLPT,IfkXX^HH}1,"กำหนดเอง, ประเพณี, ธรรมเนียม, จารีต"
風俗,ふうぞく,"manners, customs; sex industry",JLPT_1 JLPT,e3n120S&QB,"มารยาท ขนบธรรมเนียม; อุตสาหกรรมทางเพศ, ประเพณี, วัฒนธรรม, (อุตสาหกรรม) บันเทิง"
ブーツ,ブーツ,boots,JLPT_1 JLPT,Nihzy$?;~s,"รองเท้าบูท, บูท, รองเท้าหุ้มข้อ, รองเท้าหนัง"
風土,ふうど,"natural features, climate",JLPT_1 JLPT,B(IXgyGNd~,"ลักษณะทางธรรมชาติ สภาพภูมิอากาศ, ภูมิประเทศ, ภูมิอากาศ, สภาพแวดล้อม"
ブーム,ブーム,boom,JLPT_1 JLPT,FMQ@X9![T+,"บูม, รุ่งเรือง, เฟื่องฟู, พุ่งขึ้น"
フォーム,フォーム,foam; form,JLPT_1 JLPT,N.>_aoM)4S,"โฟม; รูปทรง, ฟอร์ม, แบบฟอร์ม, ท่าทาง"
部下,ぶか,one's subordinate,JLPT Intermediate_Japanese JLPT_1 Intermediate_Japanese_Ln.9 Genki_Ln.22 Genki,At:l-rSeL9,"ผู้ใต้บังคับบัญชาของตน, ลูกน้อง, ผู้ร่วมงาน, เจ้าหน้าที่"
不可欠,ふかけつ,"indispensable, essential",JLPT_1 JLPT,$D>BzY&Eq,"ขาดไม่ได้ จำเป็น, สำคัญ, เป็นสิ่งจำเป็น, อย่างยิ่ง"
ぶかぶか,ぶかぶか,"too big, baggy",JLPT_1 JLPT,M4TQ1zs9*D,"ใหญ่เกินไป หลวมเกินไป, โคร่ง, หลวมโพรก, เกินขนาด"
不吉,ふきつ,"ominous, sinister, bad luck, ill omen",JLPT_1 JLPT,GG4guCQ>St,"ลางร้าย, น่ากลัว, โชคร้าย, สัญญาณร้าย"
不況,ふきょう,"recession, depression, slump",JLPT_1 JLPT,NAxBuR@3>.,"ภาวะเศรษฐกิจถดถอย ภาวะเศรษฐกิจตกต่ำ, เศรษฐกิจซบเซา, ความตกต่ำ, ภาวะซบเซา"
布巾,ふきん,dish cloth,JLPT_1 JLPT,P<Zf%&wJ!m,"ผ้าเช็ดจาน, ผ้าขี้ริ้ว, ผ้าเช็ดมือ, ผ้าทำความสะอาด"
複合,ふくごう,"composite, complex",JLPT_1 JLPT,p=QT;iGf;n,"คอมโพสิต, ซับซ้อน, ผสมผสาน, หลายอย่าง"
福祉,ふくし,"welfare, well-being",JLPT_1 JLPT,b03!@u1#5V,"สวัสดิการ ความเป็นอยู่ที่ดี, สุขภาพ, ความสุข, ชีวิตที่ดี"
覆面,ふくめん,"mask, veil, disguise",JLPT_1 JLPT,QXg#lB9xS_,"หน้ากาก, ผ้าคลุมหน้า, การปลอมตัว, ปิดบัง"
膨れる,ふくれる,"to swell (out), to be inflated, to bulge",JLPT_1 JLPT,"Ie:O+1U,1j","บวม (ออก), พองตัว, โป่งออกมา, พอง"
不景気,ふけいき,"business recession, hard times, depression",JLPT_1 JLPT,"iNdMUnu]F,","ภาวะเศรษฐกิจถดถอย ช่วงเวลาที่ยากลำบาก ภาวะเศรษฐกิจตกต่ำ, ซบเซา, เศรษฐกิจไม่ดี, ช่วงขาลง"
耽る,ふける,"to indulge in, to give oneself up to, to be absorbed in",JLPT_1 JLPT,v[B)O.T7PD,"ดื่มด่ำ, ปล่อยตัวปล่อยใจไปกับ, หมกมุ่นอยู่กับ, เพลิดเพลิน"
老ける,ふける,to age,JLPT_1 JLPT,QZ$)s`u+7V,"ถึงอายุ, แก่ขึ้น, ชราลง, มีอายุมากขึ้น"
富豪,ふごう,"wealthy person, millionaire",JLPT_1 JLPT,de)G:rS8ob,"บุคคลร่ำรวย เศรษฐี, มหาเศรษฐี, คนรวย, ผู้มีฐานะ"
布告,ふこく,"edict, ordinance, proclamation",JLPT_1 JLPT,m`EP77(8*G,"พระราชกฤษฎีกา กฎหมาย ประกาศ, กฤษฎีกา, คำสั่ง, ข้อบังคับ"
ブザー,ブザー,buzzer,JLPT_1 JLPT,C0kjm{<IuS,"เสียงกริ่ง, ออด, กระดิ่ง, เสียงเตือน"
負債,ふさい,"debt, liabilities",JLPT_1 JLPT,qG<ySRudYV,"หนี้สิน, ภาระผูกพัน, หนี้, เงินกู้"
不在,ふざい,absence,JLPT_1 JLPT,rCM+ktTr!?,"การขาดหายไป, ไม่อยู่, การไม่มา, การขาด"
ふさわしい,ふさわしい,appropriate,JLPT_1 JLPT,j1c*Q9d`L},"เหมาะสม, สมควร, คู่ควร, ถูกต้อง"
不順,ふじゅん,"irregularity, unseasonableness",JLPT_1 JLPT,kwTZda>KFz,"ความไม่สม่ำเสมอ, ผิดฤดูกาล, ไม่ปกติ, ผิดปกติ"
負傷,ふしょう,"injury, wound",JLPT_1 JLPT,o+oZbWGZ`o,"การบาดเจ็บ, บาดแผล, อาการบาดเจ็บ, แผล"
侮辱,ぶじょく,"insult, contempt, slight",JLPT_1 JLPT,g>J&PTIuaT,"การดูถูกเหยียดหยาม การดูหมิ่น, ดูหมิ่น, หมิ่นประมาท, ลบหลู่"
不審,ふしん,"suspicious, doubt, infidelity",JLPT_1 JLPT,jmIlRt&BUg,"น่าสงสัย, ไม่แน่ใจ, นอกใจ, สงสัย"
不振,ふしん,"dullness, slump, stagnation",JLPT_1 JLPT,G]_~>elSdu,"ความน่าเบื่อหน่าย ความซบเซา ความหยุดนิ่ง, ซบเซา, ไม่ก้าวหน้า, ถดถอย"
武装,ぶそう,"arms, armament, armed",JLPT_1 JLPT,JTlLA8kPQ$,"อาวุธ, ยุทโธปกรณ์, ติดอาวุธ, อาวุธยุทโธปกรณ์"
札,ふだ,"token, label; ticket, card; charm, talisman",JLPT_1 JLPT,P_/*Zy2*:b,"เหรียญ, ป้าย; ตั๋ว, บัตร; เครื่องราง, ของขลัง"
負担,ふたん,burden; load,JLPT_1 Intermediate_Japanese_Ln.14 JLPT Intermediate_Japanese,Gta/;X`Z+t,"ภาระ; น้ำหนักบรรทุก, ภาระหนัก, เป็นภาระ, แบกรับ"
不調,ふちょう,"bad condition, disorder, slump",JLPT_1 JLPT,j!ymTpYo|(,"สภาพย่ำแย่ ความผิดปกติ ความตกต่ำ, ไม่เข้าที่, บกพร่อง, แย่ลง"
復活,ふっかつ,"revival (e.g., musical), restoration",JLPT_1 JLPT,Hga}Pqjl1G,"การฟื้นฟู (เช่น ดนตรี) การบูรณะ, ฟื้นคืน, กลับมา, คืนชีพ"
物議,ぶつぎ,public discussion (criticism),JLPT_1 JLPT,E>jQlZ<@Gi,"การอภิปรายสาธารณะ (การวิพากษ์วิจารณ์), การโต้เถียง, ข้อโต้แย้ง, ประเด็นถกเถียง"
復旧,ふっきゅう,"restoration, restitution, rehabilitation",JLPT_1 JLPT,v+skQS.kck,"การบูรณะ การชดเชย การฟื้นฟู, ซ่อมแซม, กู้คืน, ซ่อมบำรุง"
復興,ふっこう,"revival, renaissance, reconstruction",JLPT_1 JLPT,DSf6z@!#o3,"การฟื้นฟู, ยุคฟื้นฟูศิลปวิทยา, การบูรณะ, ฟื้นตัว"
物資,ぶっし,"goods, materials",JLPT_1 JLPT,wx*<XPsco8,"สินค้า วัสดุ, พัสดุ, วัตถุดิบ, สิ่งของ"
仏像,ぶつぞう,Buddhist image (statue),JLPT_1 JLPT,oCnal+d5Dm,"พระพุทธรูป (รูปปั้น), พุทธรูป, รูปปั้นพระ, เทวรูป"
物体,ぶったい,object,JLPT_1 JLPT,vQK(_s<&_e,"วัตถุ, สิ่งของ, ของ, ชิ้นส่วน"
沸騰,ふっとう,"boiling, seething",JLPT_1 JLPT,K!6nK8uJ5*,"เดือดพล่าน เดือดปุดๆ, เดือด, ต้ม, ความร้อนสูง"
不当,ふとう,"injustice, impropriety, unfair",JLPT_1 JLPT,"AB;-J~^I,j","ความอยุติธรรม, การกระทำที่ไม่เหมาะสม, ความไม่เป็นธรรม, ไม่ยุติธรรม"
不動産,ふどうさん,real estate,JLPT_1 JLPT,Mv%siEq0S4,"อสังหาริมทรัพย์, ที่ดิน, บ้าน, อสังหาฯ"
無難,ぶなん,"safety, security",JLPT_1 JLPT,L:*{h+[3Gh,"ความปลอดภัย การรักษาความปลอดภัย, ปลอดภัย, ปราศจากภัย, ไม่เสี่ยง"
赴任,ふにん,(proceeding to) new appointment,JLPT_1 JLPT,oAb.`u!o*I,"(ดำเนินการต่อ) สู่การนัดหมายใหม่, ไปรับตำแหน่งใหม่, การโยกย้าย, การแต่งตั้ง"
腐敗,ふはい,"decay, depravity",JLPT_1 JLPT,M`8*mP*qtg,"ความเสื่อมโทรม ความเลวทราม, เน่าเปื่อย, เสื่อมทราม, การคอร์รัปชัน"
不評,ふひょう,"bad reputation, disgrace, unpopularity",JLPT_1 JLPT,uWKg6kq8N?,"ชื่อเสียงเสีย, ความอัปยศอดสู, ความไม่เป็นที่นิยม, เสื่อมเสีย"
不服,ふふく,"dissatisfaction, discontent, disapproval",JLPT_1 JLPT,efQHJ:1O+%,"ความไม่พอใจ, ความไม่ลงรอย, การไม่เห็นด้วย, ความคับข้องใจ"
普遍,ふへん,"universality, ubiquity, omnipresence",JLPT_1 JLPT,DU4nCA/=D7,"ความเป็นสากล, การมีอยู่ทุกหนทุกแห่ง, การปรากฏอยู่ทุกหนทุกแห่ง, ความแพร่หลาย"
