跡継ぎ,あとつぎ,"heir, successor",JLPT JLPT_1,FOSj&QueO&,"ทายาท ผู้สืบทอด, ผู้รับมรดก, ผู้สืบสกุล, ผู้สืบสันดาน"
後回し,あとまわし,"putting off, postponing",JLPT JLPT_1,gtJh53r?xb,"การเลื่อนออกไป การชะลอออกไป, การผัดวันประกันพรุ่ง, การถ่วงเวลา, การเลื่อนเวลา"
油絵,あぶらえ,oil painting,JLPT JLPT_1,D+4-`qnb~N,"ภาพวาดสีน้ำมัน, ภาพเขียนสีน้ำมัน, งานจิตรกรรมสีน้ำมัน, ศิลปะสีน้ำมัน"
アプローチ,アプローチ,approach (in golf),JLPT JLPT_1,jEr0e9w(yl,"วิธีการเข้าหาเป้าหมาย (ในกีฬากอล์ฟ), การเข้าถึง, วิธีการ, แนวทาง"
あべこべ,あべこべ,"contrary, opposite, inverse",JLPT JLPT_1,"H,+X<T.gD6","ตรงกันข้าม, ตรงข้าม, กลับด้าน, สลับกัน"
甘える,あまえる,"to behave like a spoiled child, to fawn on",JLPT JLPT_1,Ive+A5(inn,"ประพฤติตัวเหมือนเด็กเอาแต่ใจ ประจบประแจง, อ้อน, สำออย, เรียกร้องความสนใจ"
雨具,あまぐ,rain gear,JLPT JLPT_1,I?IUPpQj*?,"อุปกรณ์กันฝน, เสื้อกันฝน, ร่ม, เครื่องกันฝน"
甘口,あまくち,sweet flavor,JLPT JLPT_1,RiEI$=-[gq,"รสหวาน, อ่อนโยน, รสอ่อน, ไม่เผ็ด"
アマチュア,アマチュア,amateur,JLPT JLPT_1,cX1.fT!T=M,"มือสมัครเล่น, ผู้ไม่ใช่มืออาชีพ, มือใหม่, ผู้ฝึกหัด"
網,あみ,net,JLPT JLPT_1,H|d6ZL#<h!,"สุทธิ, ตาข่าย, แห, ข่าย"
操る,あやつる,"to manipulate, to operate, to pull strings",JLPT JLPT_1,NxyDR}@Pt9,"ควบคุม บงการ ชักใย, บังคับ, ใช้การ, สั่งการ"
危ぶむ,あやぶむ,"to fear, to have misgivings, to be doubtful",JLPT_1 JLPT,NLhG0QOC$/,"กลัว, มีความกังวล, ไม่แน่ใจ, หวาดหวั่น"
あやふや,あやふや,"uncertain, vague, ambiguous",JLPT_1 JLPT,LTY%:.1iV#,"ไม่แน่นอน คลุมเครือ กำกวม, เลือนราง, พร่ามัว, ไม่ชัดเจน"
過ち,あやまち,"fault, error, indiscretion",JLPT_1 JLPT,tiN`@Or{&y,"ความผิดพลาด, ข้อบกพร่อง, ความไม่รอบคอบ, การทำผิด"
誤る,あやまる,to make a mistake,JLPT_1 JLPT,y69Q^~B7be,"ทำผิดพลาด, พลาด, หลงผิด, ทำให้เข้าใจผิด"
歩み,あゆみ,"step, progress, history",JLPT_1 JLPT,d|SHU+C9ln,"ขั้นตอน ความก้าวหน้า ประวัติ, จังหวะก้าว, การเคลื่อนที่, การพัฒนา"
歩む,あゆむ,to walk,JLPT_1 JLPT,wd7~%O7i%s,"เดิน, ก้าว, เคลื่อนที่, ดำเนินไป"
予め,あらかじめ,"in advance, previously",JLPT_1 JLPT,M^Q%nck}}~,"ล่วงหน้า ก่อนหน้านี้, ก่อนเวลา, แต่แรก, ตั้งแต่ต้น"
荒らす,あらす,to damage; to invade,JLPT_1 JLPT,F`n@R=:)nH,"ทำให้เสียหาย; บุกรุก, ทำลายล้าง, รุกราน, ปล้นสะดม"
争い,あらそい,"dispute, quarrel, conflict",JLPT_1 JLPT,iM26j%{^}<,"ข้อพิพาท, การทะเลาะวิวาท, ความขัดแย้ง, การต่อสู้"
改まる,あらたまる,to be renewed; to be formal,JLPT_1 JLPT,POJ?~MwZC;,"เพื่อต่ออายุ; เพื่อให้เป็นทางการ, ปรับปรุงใหม่, จริงจัง, เป็นระเบียบ"
荒っぽい,あらっぽい,"rough, rude",JLPT_1 JLPT,"b<,B2X1W>,","หยาบกระด้าง หยาบคาย, รุนแรง, ดุดัน, ไม่สุภาพ"
アラブ,アラブ,Arab,JLPT_1 JLPT,w?fz6N5_8f,"อาหรับ, ชาวอาหรับ, ประเทศอาหรับ, ภาษาอาหรับ"
霰,あられ,"hail (e.g., falling ice balls)",JLPT_1 JLPT,l3>xH[yiS~,"ลูกเห็บ (เช่น ก้อนน้ำแข็งที่ตกลงมา), หิมะลูกเห็บ, ก้อนน้ำแข็ง, พายุลูกเห็บ"
有り様,ありさま,"state, condition",JLPT_1 JLPT,riAt}Dj+*6,"สถานะ, สภาพ, เหตุการณ์, ความเป็นอยู่"
ありのまま,ありのまま,"the truth, as it is, frankly",JLPT_1 JLPT,u#p2]kp|]n,"ความจริงตามที่เป็นอยู่ พูดกันตามตรงเลยนะ, ตามธรรมชาติ, ตรงไปตรงมา, โดยแท้จริง"
ありふれる,ありふれる,"common, ordinary, routine",JLPT_1 JLPT,L>m1Qj9_w`,"ทั่วไป, ปกติ, เป็นประจำ, ดาดๆ"
アルカリ,アルカリ,alkali,JLPT_1 JLPT,bjn}>(kN_4,"ด่าง, สารด่าง, อัลคาไลน์, สภาพด่าง"
アルミ,アルミ,"aluminum (Al, aluminum)",JLPT_1 JLPT,hd2y8v&/eK,"อะลูมิเนียม (Al, อะลูมิเนียม), โลหะอะลูมิเนียม, แร่ธาตุอะลูมิเนียม"
アワー,アワー,hour,JLPT_1 JLPT,mk~JH>ZLLt,"ชั่วโมง, หนึ่งชั่วโมง, ระยะเวลาหนึ่งชั่วโมง, เวลาหนึ่งชั่วโมง"
合わす,あわす,"to join together, to face, to unite",JLPT_1 JLPT,NbeP;-&Q9x,"เพื่อร่วมมือกัน เพื่อเผชิญหน้า เพื่อรวมเป็นหนึ่งเดียว, รวมเข้าด้วยกัน, ปรับให้เข้ากัน, ประสานกัน"
～合せ,～あわせ,in all,JLPT_1 JLPT,txB~izZs$4,"ในทุกๆ, การจับคู่, การผสมผสาน, การเข้ากัน"
アンコール,アンコール,encore,JLPT_1 JLPT,Nor`ur!?#f,"อังกอร์, การเรียกร้องให้แสดงอีก, ขออีกครั้ง, การแสดงซ้ำ"
暗殺,あんさつ,assassination,JLPT_1 JLPT,k9nuX~0z?!,"การลอบสังหาร, การฆาตกรรมลับ, การปลิดชีพ, การสังหาร"
暗算,あんざん,mental arithmetic,JLPT_1 JLPT,iVkFrF?o$Q,"การคำนวณทางจิต, คิดเลขในใจ, การบวกเลขในใจ, การคิดคำนวณในหัว"
暗示,あんじ,"hint, suggestion",JLPT_1 JLPT,v]TQH!b:3E,"คำแนะนำ, ข้อเสนอแนะ, การบอกใบ้, การชี้แนะ"
案じる,あんじる,"to be anxious, to ponder",JLPT_1 JLPT,A+tw-W2up/,"รู้สึกกังวลใจ ครุ่นคิด, คิดมาก, คิดใคร่ครวญ, หนักใจ"
安静,あんせい,rest,JLPT_1 JLPT,m~/57eSA#(,"พักผ่อน, ความสงบ, การหยุดพัก, การอยู่เฉยๆ"
案の定,あんのじょう,"sure enough, as usual",JLPT_1 JLPT,hA}d;?>d]S,"แน่นอน เหมือนเช่นเคย, ตามคาด, ตามที่คิดไว้, เป็นไปตามนั้น"
いい加減,いいかげん,"random, irresponsible",JLPT_1 JLPT,m&1q/@m2Fo,"สุ่มสี่สุ่มห้า ไร้ความรับผิดชอบ, สะเพร่า, ลวกๆ, ไม่จริงจัง"
言い訳,いいわけ,"excuse, explanation",JLPT_1 JLPT,bHn3PYYDDh,"ข้อแก้ตัว คำอธิบาย, การแก้ตัว, การชี้แจง, คำขอโทษ"
イェス,イェス,yes; Jesus,JLPT_1 JLPT,JNh+4Yr8ef,"ใช่; พระเยซู, ครับ/ค่ะ, พระคริสต์, ศาสดาเยซู"
家出,いえで,running away from home,JLPT_1 JLPT,Q=S6%hckV-,"หนีออกจากบ้าน, การหนีตาม, การหลบหนี, การจากบ้าน"
生かす,いかす,to keep something alive; to make use of,JLPT_1 JLPT,I!~Ls+W17l,"เพื่อรักษาสิ่งใดสิ่งหนึ่งให้มีชีวิตอยู่; เพื่อใช้ประโยชน์, ใช้ให้เป็นประโยชน์, ฟื้นฟู, ทำให้มีชีวิตชีวา"
いかに,いかに,"how, in what way",JLPT_1 JLPT,wc[[YL_8xy,"อย่างไร ด้วยวิธีใด, แค่ไหน, เพียงใด, มากเท่าไหร่"
いかにも,いかにも,truly (same as 実に (じつに)),JLPT_1 JLPT Intermediate_Japanese_Ln.13 Intermediate_Japanese,pGTXJh*xKy,"อย่างแท้จริง (เหมือนกับ 実に (じつに)), แท้จริง, โดยแท้, จริงๆ"
異議,いぎ,"objection, dissent, protest",JLPT_1 JLPT,Ipl}wWGO>v,"การคัดค้าน, การไม่เห็นด้วย, การประท้วง, การโต้แย้ง"
生き甲斐,いきがい,"something one lives for, very important",JLPT_1 JLPT,q|opo=i1Z%,"สิ่งที่คนเรายึดมั่นและใช้ชีวิตอยู่เพื่อมัน สำคัญมาก, จุดมุ่งหมายของชีวิต, คุณค่าของชีวิต, เป้าหมายในชีวิต"
行き違い,いきちがい,"misunderstanding, disagreement",JLPT_1 JLPT,Kn3O$k3Ndh,"ความเข้าใจผิด ความไม่ลงรอย, การสวนทาง, การสื่อสารผิดพลาด, ความคลาดเคลื่อน"
意気込む,いきごむ,to be enthusiastic about,JLPT_1 JLPT,"uCP,dS?ITJ","มีความกระตือรือร้นเกี่ยวกับ, มีความมุ่งมั่น, มีความตั้งใจ, พยายามอย่างแข็งขัน"
育成,いくせい,"rearing, training, cultivation",JLPT_1 JLPT,xgDyhh?MvF,"การเลี้ยงดู การฝึกฝน การเพาะปลูก, การบ่มเพาะ, การพัฒนา, การส่งเสริม"
幾多,いくた,"many, numerous",JLPT_1 JLPT,sVgAdcK5_K,"มากมาย นับไม่ถ้วน, จำนวนมาก, เป็นจำนวนมาก, อุดมสมบูรณ์"
"(花を〜) 生ける, 活ける",(はなを～) いける,to arrange (flowers),JLPT JLPT_1 MediaMissing,"cEGS[d,K$s","จัดดอกไม้, ปักดอกไม้, ตกแต่งดอกไม้, จัดแจงดอกไม้"
異見,いけん,"different opinion, objection",JLPT_1 JLPT,C`nnyFMEP*,"ความคิดเห็นที่แตกต่าง การคัดค้าน, ข้อโต้แย้ง, ความเห็นแย้ง, ความขัดแย้งทางความคิด"
意向,いこう,"intention, idea, inclination",JLPT_1 JLPT,c<RmCn8fq1,"เจตนา ความคิด ความโน้มเอียง, จุดประสงค์, วัตถุประสงค์, ความตั้งใจ"
移行,いこう,switching over to,JLPT_1 JLPT,zCUU7WXKx4,"เปลี่ยนไปใช้, การเปลี่ยนผ่าน, การโยกย้าย, การปรับเปลี่ยน"
いざ,いざ,"now, come (now), crucial moment",JLPT_1 JLPT,i:/h1W-xdl,"ตอนนี้ ช่วงเวลาสำคัญ, ณ บัดนี้, ถึงเวลา, ช่วงหัวเลี้ยวหัวต่อ"
移住,いじゅう,"migration, immigration",JLPT_1 JLPT,yfmy@>bgJz,"การย้ายถิ่นฐาน การอพยพ, การอพยพออก, การย้ายไปอยู่, การย้ายถิ่นฐานใหม่"
衣装,いしょう,"clothing, costume, outfit",JLPT_1 JLPT,JM:)/^6vfs,"เสื้อผ้า เครื่องแต่งกาย ชุด, อาภรณ์, พัสตราภรณ์, เครื่องนุ่งห่ม"
いじる,いじる,"to touch, to tamper with",JLPT_1 JLPT,9Nx^_^#j8,"สัมผัส, ดัดแปลงแก้ไข, แตะต้อง, ยุ่ง"
異性,いせい,the opposite sex,JLPT_1 JLPT,c(LysD`~z],"เพศตรงข้าม, เพศที่แตกต่าง, ฝ่ายตรงข้าม, ต่างเพศ"
遺跡,いせき,historic ruins,JLPT_1 JLPT,FHxuAULxsj,"ซากปรักหักพังทางประวัติศาสตร์, โบราณสถาน, แหล่งโบราณคดี, ซากโบราณ"
依存,いぞん,"dependence, dependent, reliance",JLPT_1 JLPT,vHQ}.~FHmp,"การพึ่งพา, ผู้ถูกพึ่งพา, ความไว้วางใจ, การยึดติด"
委託,いたく,"consign (goods (for sale) to a firm), entrust",JLPT_1 JLPT,"JRy,(Dx:,n","ฝากขาย (สินค้า) ให้กับบริษัทอื่น, มอบหมาย, มอบอำนาจ, ให้รับผิดชอบ"
いたって,いたって,"very much, exceedingly, extremely",JLPT_1 JLPT,%<{<.)4xj,"มาก อย่างยิ่ง อย่างมาก, อย่างที่สุด, เป็นอย่างมาก, มหาศาล"
出世,しゅっせ,"promotion, successful career, eminence",JLPT_1 JLPT,"E,W%,6&bwX","การเลื่อนตำแหน่ง, อาชีพที่ประสบความสำเร็จ, ความโดดเด่น, การก้าวหน้า"
出題,しゅつだい,proposing a question,JLPT_1 JLPT,s9z]c<[6wR,"การตั้งคำถาม, การออกข้อสอบ, การกำหนดคำถาม, การตั้งโจทย์"
出動,しゅつどう,"mobilization, action",JLPT_1 JLPT,DVV5Q3:VIK,"การระดมพล การดำเนินการ, การเคลื่อนพล, การส่งกำลัง, การออกปฏิบัติการ"
出費,しゅっぴ,"expenses, disbursements",JLPT_1 JLPT,t(JNS{XhuZ,"ค่าใช้จ่าย การเบิกจ่าย, รายจ่าย, เงินที่ใช้ไป, งบประมาณ"
出品,しゅっぴん,"exhibit, display",JLPT_1 JLPT,w}1f=TEQZ|,"จัดแสดง, โชว์, ของที่นำมาแสดง, สิ่งจัดแสดง"
主導,しゅどう,main leadership,JLPT_1 JLPT,"d-6;%xC,V(","ผู้นำหลัก, บทบาทนำ, ผู้ริเริ่ม, การเป็นหัวหน้า"
主任,しゅにん,"person in charge, responsible official",JLPT_1 JLPT Intermediate_Japanese_Ln.8 Intermediate_Japanese,P`pi2j!/Zn,"ผู้รับผิดชอบ, เจ้าหน้าที่ผู้รับผิดชอบ, หัวหน้างาน, ผู้ดูแล"
首脳,しゅのう,"head, leader",JLPT_1 JLPT,mH>udydI<),"หัวหน้า, ผู้นำ, ผู้บริหารสูงสุด, คณะผู้นำ"
守備,しゅび,defense,JLPT_1 JLPT,QyYK8_+Gx6,"การป้องกัน, การคุ้มกัน, การอารักขา, การพิทักษ์"
手法,しゅほう,technique,JLPT_1 JLPT,fWl){e*%x`,"เทคนิค, วิธีการ, กลยุทธ์, แนวทาง"
樹木,じゅもく,"trees and shrubs, arbor",JLPT_1 JLPT,A6EcuVTEn~,"ต้นไม้และไม้พุ่ม ซุ้มไม้เลื้อย, พืชยืนต้น, ต้นไม้พุ่ม, พันธุ์ไม้"
樹立,じゅりつ,"establish, create",JLPT_1 JLPT,<gHQ~x_IM,"ก่อตั้ง สร้าง, สถาปนา, จัดตั้ง, ทำให้เกิดขึ้น"
準急,じゅんきゅう,"local express (train, slower than an express)",JLPT_1 JLPT,s!T{c]d?zv,"รถไฟท้องถิ่น (รถไฟ ช้ากว่ารถไฟด่วน), รถไฟด่วนท้องถิ่น, รถด่วนรอง, รถไฟกึ่งด่วน"
準じる,じゅんじる,"to follow, to conform, to apply to",JLPT_1 JLPT,j=V@~uS;G4,"ปฏิบัติตาม, สอดคล้อง, นำไปใช้, ยึดถือ"
～署,～しょ,department,JLPT_1 JLPT,A<!E3T_0vF,"แผนก, สถานี, หน่วยงาน, กอง"
～症,～しょう,disease,JLPT_1 JLPT,y^!rJ~5v8t,"โรค, อาการป่วย, กลุ่มอาการ, ความเจ็บป่วย"
～証,～しょう,"proof, certificate",JLPT_1 JLPT,w[XPaJS[}z,"หลักฐาน, ใบรับรอง, ใบอนุญาต, เอกสารยืนยัน"
～嬢,～じょう,young woman,JLPT_1 JLPT,P&R@B~a4:4,"หญิงสาว, สุภาพสตรี, กุลสตรี, เยาวสตรี"
上位,じょうい,"superior, higher order",JLPT_1 JLPT,s<}P@-YNu`,"เหนือกว่า ลำดับสูงกว่า, อันดับสูง, ระดับสูง, ชั้นสูง"
上演,じょうえん,art performance,JLPT_1 JLPT,Ih+PnzSX5U,"การแสดงศิลปะ, การจัดแสดง, การแสดงละคร, การโชว์"
城下,じょうか,land near the castle,JLPT_1 JLPT,FP&uiV(R^g,"ที่ดินใกล้ปราสาท, เมืองใต้ปราสาท, บริเวณใกล้ปราสาท, ชานเมืองปราสาท"
消去,しょうきょ,"elimination, erasing",JLPT_1 JLPT,KIr]^O720X,"การกำจัด การลบ, การลบทิ้ง, การถอดออก, การขจัด"
上空,じょうくう,"sky, high-altitude sky, upper air",JLPT_1 JLPT,AT)AL!}Jds,"ท้องฟ้า, ท้องฟ้าระดับสูง, อากาศเบื้องบน, เวหา"
衝撃,しょうげき,"shock, crash, impact, ballistic",JLPT_1 JLPT,rK5G)+e65!,"แรงกระแทก, การชน, การปะทะ, ขีปนาวุธ"
証言,しょうげん,"evidence, testimony",JLPT_1 JLPT,s_3h<=-PI[,"หลักฐาน คำให้การ, คำสาบาน, คำยืนยัน, คำให้ปากคำ"
証拠,しょうこ,"evidence, proof",JLPT_1 JLPT,H}OPDaDiwx,"หลักฐาน, ข้อพิสูจน์, พยานหลักฐาน, สิ่งยืนยัน"
照合,しょうごう,"check, verification",JLPT_1 JLPT,hlgHN62g|{,"ตรวจสอบ ยืนยัน, ตรวจทาน, เปรียบเทียบ, การพิสูจน์"
詳細,しょうさい,"detail, particulars",JLPT_1 JLPT,K:oLa1D.!N,"รายละเอียด, ข้อมูลเฉพาะ, ข้อปลีกย่อย, รายละเอียดปลีกย่อย"
上昇,じょうしょう,"rising, ascending, climbing",JLPT_1 JLPT,sWkm1|AEBC,"ขึ้น, ปีนป่าย, การเพิ่มขึ้น"
昇進,しょうしん,promotion,JLPT_1 JLPT,d~xF3H=[az,"การส่งเสริม, การเลื่อนตำแหน่ง, การก้าวหน้าในอาชีพ, การปรับเลื่อน"
称する,しょうする,"to take the name of, to call oneself",JLPT_1 JLPT,tSb%>:%%!V,"ใช้ชื่อของ, เรียกตัวเองว่า, อ้างว่าเป็น, แอบอ้าง"
情勢,じょうせい,"state of things, condition, situation",JLPT_1 JLPT,MJ1D.[x{)c,"สภาวะ สภาพ สถานการณ์, เหตุการณ์, เรื่องราว, ภาวะการณ์"
消息,しょうそく,"news, letter, circumstances",JLPT_1 JLPT,u6>otPY%%b,"ข่าวสาร จดหมาย สถานการณ์, ข่าวคราว, ที่อยู่, ความเป็นไป"
承諾,しょうだく,"consent, agreement",JLPT_1 JLPT,qBKI4V%6RZ,"ความยินยอม ข้อตกลง, การอนุมัติ, การเห็นชอบ, การยอมรับ"
情緒,じょうちょ,"emotion, feeling",JLPT_1 JLPT,k3To8MWJIl,"อารมณ์ ความรู้สึก, ความรู้สึกนึกคิด, บรรยากาศ, ความรู้สึกอ่อนไหว"
情緒,じょうしょ,"emotion, feeling",JLPT_1 JLPT,tX-.yH%tsu,"อารมณ์ ความรู้สึก, สภาพจิตใจ, สภาพอารมณ์, ความรู้สึกภายใน"
象徴,しょうちょう,symbol,JLPT_1 JLPT,Nr_Pr2R$>-,"เครื่องหมาย, สัญลักษณ์, ตรา, สิ่งแทน"
小児科,しょうにか,pediatrics,JLPT_1 JLPT,BV(PyO5`Xp,"กุมารเวชศาสตร์, แผนกกุมารเวช, กุมารแพทย์, วิชาโรคเด็ก"
使用人,しようにん,"employee, servant",JLPT_1 JLPT,LygcFyOci?,"พนักงาน, คนรับใช้, ลูกจ้าง, ผู้รับใช้ในบ้าน"
情熱,じょうねつ,"passion, enthusiasm, zeal",JLPT_1 JLPT,I{iqV8B>VE,"ความหลงใหล ความกระตือรือร้น ความมุ่งมั่น, ความเร่าร้อน, ความกระหาย, ความลุ่มหลง"
譲歩,じょうほ,"concession, conciliation, compromise",JLPT_1 JLPT,qTRRmo8`cg,"การยอมอ่อนข้อ การประนีประนอม การตกลงกัน, การยินยอม, การยอมถอย, ข้อตกลงร่วมกัน"
条約,じょうやく,"treaty, pact",JLPT_1 JLPT Intermediate_Japanese_Ln.8 Intermediate_Japanese,mBj5_YKg@T,"สนธิสัญญา, ข้อตกลง, อนุสัญญา, ความตกลง"
勝利,しょうり,"victory, triumph, win",JLPT_1 JLPT,G@C3MHqMp~,"ชัยชนะ, ความสำเร็จ, การชนะ, ชัย"
上陸,じょうりく,"landing, disembarkation",JLPT_1 JLPT,P?*6mTt|Ou,"การขึ้นฝั่ง การลงจากเรือ, การขึ้นบก, การมาถึง, การเทียบท่า"
蒸溜,じょうりゅう,distillation,JLPT_1 JLPT,N0wHhg4iZ},"การกลั่น, การสกัด, การแยกสาร, กระบวนการกลั่น"
奨励,しょうれい,"encouragement, promotion",JLPT_1 JLPT,m8|HwkmQWl,"การให้กำลังใจ การส่งเสริม, การกระตุ้น, การสนับสนุน, การหนุนใจ"
ショー,ショー,show,JLPT_1 JLPT,i~@270zDDg,"แสดง, การแสดงสด, การนำเสนอ, งานแสดง"
除外,じょがい,"exception, exclusion",JLPT_1 JLPT,An-_sCcDl?,"ข้อยกเว้น การยกเว้น, การไม่รวม, การคัดออก, การตัดออก"
職員,しょくいん,"staff member, personnel",JLPT_1 JLPT,"c/)%MF,^yx","พนักงาน, บุคลากร, เจ้าหน้าที่, ผู้ปฏิบัติงาน"
植民地,しょくみんち,colony,JLPT_1 JLPT,pqv+nRs.EA,"อาณานิคม, เมืองขึ้น, ดินแดนอาณานิคม, นิคม"
職務,しょくむ,professional duties,JLPT_1 JLPT,M%7$<MDK;D,"หน้าที่ทางวิชาชีพ, หน้าที่การงาน, ภาระหน้าที่, ตำแหน่งหน้าที่"
諸君,しょくん,"Gentlemen!, Ladies!",JLPT_1 JLPT,w8&8<Oq8q1,"สุภาพบุรุษ! สุภาพสตรี!, ท่านทั้งหลาย, ทุกท่าน, พี่น้อง"
助言,じょげん,"advice, suggestion",JLPT_1 JLPT Intermediate_Japanese Intermediate_Japanese_Ln.11,jgva&{5Yv},"คำแนะนำ ข้อเสนอแนะ, ข้อแนะนำ, คำปรึกษา, แนะนำ"
徐行,じょこう,going slowly,JLPT_1 JLPT,1}h4@}[.},"ค่อยๆไป, ช้าๆ, ขับช้า, เดินช้า"
