うたた寝,うたたね,"dozing, napping",JLPT_1 JLPT,g>}T9.Ly4K,"งีบหลับ, งีบ, เคลิ้มหลับ, นอนกลางวัน"
打ち明ける,うちあける,"to confess, to be open",JLPT_1 JLPT,m>OKlxKk@!,"สารภาพ, เปิดเผย, บอกความจริง, แสดงความรู้สึก"
打ち切る,うちきる,"to stop, to abort, to discontinue, to close",JLPT_1 JLPT,NY3MFaZc*o,"หยุด, ยกเลิก, ยุติ, ปิด"
打ち消し,うちけし,"(gram) negation, denial, negative",JLPT_1 JLPT,FFlOc.L!8+,"(แกรม) การปฏิเสธ, การไม่ยอมรับ, เชิงลบ, การหักล้าง"
打ち込む,うちこむ,"to devote oneself to, to shoot into",JLPT_1 JLPT,"iV,JA!*tZ)","เพื่ออุทิศตนให้กับ, เพื่อยิงเข้าไป, ตั้งใจทำ, ใส่เข้าไป"
団扇,うちわ,fan,JLPT_1 JLPT,AXix@CPuvn,"พัดลม, พัด, พัดมือ, พัดโบก"
内訳,うちわけ,"the items, breakdown, classification",JLPT_1 JLPT,"kc.tS5mj},","รายการ การแยกย่อย การจำแนกประเภท, รายละเอียด, การแจกแจง, แยกรายการ"
写し,うつし,"copy, duplicate",JLPT_1 JLPT,o]mr>S?=4H,"คัดลอก, ทำซ้ำ, สำเนา, ฉบับคัดลอก"
訴え,うったえ,"lawsuit, complaint",JLPT_1 JLPT,L0%2@MBXxQ,"การฟ้องร้อง, การร้องเรียน, คดีความ, ข้อร้องทุกข์"
うっとうしい,うっとうしい,"weary, annoying",JLPT_1 JLPT,D_nkEIxjCi,"เหนื่อยหน่าย น่ารำคาญ, น่าเบื่อ, อึดอัด, เซ็ง"
うつむく,うつむく,"to look downward, to stoop",JLPT_1 JLPT,vZ9f:pDf9{,"มองลงต่ำ ก้มตัวลง, ก้มหน้า, ค้อมตัว, โน้มตัว"
空ろ,うつろ,"blank, hollow, empty",JLPT_1 JLPT,gT)UMo=-nJ,"ว่างเปล่า, กลวง, โล่ง, เวิ้งว้าง"
器,うつわ,"bowl, vessel, container",JLPT_1 JLPT,wCFSLHrDCy,"ชาม, ภาชนะ, เครื่องใช้"
腕前,うでまえ,"ability, skill, facility",JLPT_1 JLPT,M#fh/cwlNl,"ความสามารถ ทักษะ ความสะดวก, ฝีมือ, ความชำนาญ, ความเก่งกาจ"
雨天,うてん,rainy weather,JLPT_1 JLPT,w*!:re!1<+,"สภาพอากาศฝนตก, วันฝนตก, ฤดูฝน, ช่วงฝนตก"
促す,うながす,"to urge, to suggest, to demand",JLPT_1 JLPT,wV^GWyWg_j,"เพื่อกระตุ้น เพื่อแนะนำ เพื่อเรียกร้อง, เร่งเร้า, ชักชวน, บังคับ"
うぬぼれ,うぬぼれ,"pretension, conceit, hubris",JLPT_1 JLPT,m]YR4b{=@z,"ความเย่อหยิ่ง ความทะนงตน ความโอหัง, ความจองหอง, ความหลงตัวเอง, ความถือตัว"
生まれつき,うまれつき,"by nature, by birth, native",JLPT_1 JLPT,vf1rqkwzEV,"โดยธรรมชาติ โดยกำเนิด โดยกำเนิด, โดยสันดาน, แต่กำเนิด, ติดตัวมา"
埋め込む,うめこむ,"to embed, implant",JLPT_1 JLPT,xua#+HlIBN,"ฝัง, ฝังเข้าไปในร่างกาย, ปลูกถ่าย, สอดใส่"
梅干し,うめぼし,dried plum,JLPT_1 JLPT,y[D$6jL9AV,"ลูกพลัมแห้ง, บ๊วยแห้ง, บ๊วยเค็ม, บ๊วยดอง"
裏返し,うらがえし,"inside out, reverse",JLPT_1 JLPT,x!`i3g6fj/,"กลับด้าน, พลิกกลับ, ด้านในออก"
売り出し,うりだし,(bargain) sale,JLPT_1 JLPT,e#9|l1/ymz,"ลดราคา (ต่อรองราคา), ขายลดราคา, จัดรายการ, โปรโมชั่น"
売り出す,うりだす,"to put on sale, to market",JLPT_1 JLPT,gIddcx*`Ct,"นำออกขาย, นำออกสู่ตลาด, วางตลาด, จำหน่าย"
潤う,うるおう,to be moist; to profit by,JLPT_1 JLPT,iEM[52wf::,"ชุ่มชื้น; ได้รับผลประโยชน์จาก, เปียกชื้น, ได้กำไร, ได้ผลประโยชน์"
浮気,うわき,"affair, to cheat",JLPT_1 JLPT,niMRrvhuXD,"นอกใจ, โกง, ชู้, มีกิ๊ก"
上回る,うわまわる,to exceed,JLPT_1 JLPT,xvIWa_An&S,"เกินกว่า, เหนือกว่า, มากกว่า, ล้ำหน้า"
植わる,うわる,to be planted,JLPT_1 JLPT,q/mwW_I)&k,"ที่จะปลูก, ถูกปลูก, มีการเพาะปลูก, ปลูกไว้"
運営,うんえい,"management, administration, operation",JLPT_1 JLPT,m*%9#Uxp/F,"การจัดการ การบริหาร การดำเนินงาน, การบริหารจัดการ, การปฏิบัติงาน, การจัดการดูแล"
うんざり,うんざり,"tedious, boring, being fed up with",JLPT_1 JLPT,G<U}3bYTX=,"น่าเบื่อ จำเจ เบื่อหน่าย, เอือมระอา, ซ้ำซาก, ไม่มีรสชาติ"
運送,うんそう,"shipping, freight",JLPT_1 JLPT,DH/^v}5V5H,"การขนส่งทางเรือ, การขนส่งสินค้า, การส่งของ, การลำเลียง"
運賃,うんちん,"freight rates, shipping expenses, (passenger) fare",JLPT_1 JLPT Intermediate_Japanese_Ln.10 Intermediate_Japanese,"OS<,k|.D(5","อัตราค่าขนส่ง ค่าใช้จ่ายในการขนส่ง ค่าโดยสาร (ผู้โดยสาร), ค่าระวาง, ค่าเดินทาง, ค่าธรรมเนียมขนส่ง"
云々,うんぬん,"and so on, and so forth",JLPT_1 JLPT,LiOOViPg]s,"และอื่นๆ อีกมากมาย, เป็นต้น, เป็นอาทิ, อื่นๆ"
運搬,うんぱん,"transport, carriage",JLPT_1 JLPT,KHqZvxZ@6.,"การขนส่ง, พาหนะ, การเคลื่อนย้าย, การบรรทุก"
運命,うんめい,fate,JLPT_1 JLPT,l3_#00|#9V,"โชคชะตา, พรหมลิขิต, เคราะห์กรรม, วาสนา"
運輸,うんゆ,transportation,JLPT_1 JLPT,"M~H0atu}?,","การขนส่ง, การคมนาคม, การลำเลียงขนส่ง, การเคลื่อนย้าย"
運用,うんよう,"making use of, application, practical use",JLPT_1 JLPT,P{!{:>o!_q,"การใช้ประโยชน์ การประยุกต์ใช้ การใช้งานจริง, การนำไปใช้, การใช้สอย, การปฏิบัติ"
エアメール,エアメール,air mail,JLPT_1 JLPT,q`%AC;;9Ta,"ไปรษณีย์อากาศ, จดหมายอากาศ, ส่งทางอากาศ, พัสดุทางอากาศ"
～営,～えい,~ run,JLPT_1 JLPT,dP^UCy0C~l,"~ รัน, ~ ดำเนินการ, ~ ปฏิบัติงาน, ~ บริหาร"
英字,えいじ,English letter (character),JLPT_1 JLPT,"J1lN,M8$1h","อักษรภาษาอังกฤษ (อักขระ), ตัวอักษรภาษาอังกฤษ, พยัญชนะภาษาอังกฤษ, ตัวหนังสือภาษาอังกฤษ"
映写,えいしゃ,projection,JLPT_1 JLPT,x`Mnz)m&qb,"การฉายภาพ, การฉายแสง, การส่องภาพ, การแสดงภาพ"
映像,えいぞう,"reflection, image",JLPT_1 JLPT,m?:Se-SQN4,"ภาพสะท้อน, รูปภาพ, ภาพลักษณ์, ภาพเคลื่อนไหว"
英雄,えいゆう,"hero, great man",JLPT_1 JLPT,lpc:AiI>>Z,"วีรบุรุษ, บุคคลผู้ยิ่งใหญ่, ผู้กล้า, มหาบุรุษ"
液,えき,"liquid, fluid",JLPT_1 JLPT,r(jP%;ZEI5,"ของเหลว, ของไหล, น้ำ, สารละลาย"
閲覧,えつらん,"inspection, reference, browse",JLPT_1 JLPT,hDsmHpZ7Os,"การตรวจสอบ การอ้างอิง การเรียกดู, การพิจารณา, การค้นหา, การดูข้อมูล"
獲物,えもの,"game, spoils, trophy",JLPT_1 JLPT,5*sGNpi>A,"เกม, ของรางวัล, ถ้วยรางวัล, เหยื่อ"
襟,えり,"neck, collar",JLPT_1 JLPT,tRB]@ee=lY,"คอ, ปกเสื้อ, คอเสื้อ, ชายเสื้อ"
エレガント,エレガント,elegant,JLPT_1 JLPT,efgo>`$5}C,"สง่างาม, หรูหรา, งดงาม, มีสไตล์"
円滑,えんかつ,"harmony, smoothness",JLPT_1 JLPT,Kb_Dvgh:lA,"ความกลมกลืน ความราบรื่น, ความคล่องตัว, ความสอดคล้อง, ไม่มีสะดุด"
縁側,えんがわ,"veranda, porch, balcony, open corridor",JLPT_1 JLPT,wyHg^[mZl2,"ระเบียง, ชานบ้าน, เฉลียง, ทางเดินเปิดโล่ง"
沿岸,えんがん,"coast, shore",JLPT_1 JLPT,AovU9kG]Un,"ชายฝั่ง, ริมทะเล, ชายหาด, ฝั่งทะเล"
婉曲,えんきょく,"euphemistic, indirect, insinuating",JLPT_1 JLPT,G;:<3(vTfF,"ใช้คำพูดที่สุภาพ, อ้อมๆ, บอกเป็นนัยๆ, นัยประหวัด"
演出,えんしゅつ,"production (erg. play, direction)",JLPT_1 JLPT,"wf^,)@RdCb","การผลิต (เช่น บทละคร การกำกับ), การแสดง, การจัดฉาก, การอำนวยการ"
エンジニア,エンジニア,engineer,JLPT_1 JLPT,B{mLrpXMY9,"วิศวกร, นายช่าง, ช่างเทคนิค, ผู้เชี่ยวชาญด้านวิศวกรรม"
演じる,えんじる,"to perform, to play (a part), to act",JLPT_1 JLPT,"w/:3TeD,r|","แสดง, เล่น (บทบาท), แสดงละคร, รับบท"
演ずる,えんずる,"to perform, to play (a part), to act",JLPT_1 JLPT,D7;+x/XKhh,"แสดง, เล่น (บทบาท), แสดงละคร, บรรเลง"
沿線,えんせん,along railway line,JLPT_1 JLPT,ALo8teWhD7,"ตามแนวทางรถไฟ, เลียบทางรถไฟ, ข้างทางรถไฟ, ริมรางรถไฟ"
縁談,えんだん,marriage proposal,JLPT_1 JLPT,noJgGKIj8x,"การขอแต่งงาน, การสู่ขอ, การหมั้นหมาย, เรื่องแต่งงาน"
遠方,えんぽう,"long way, distant place",JLPT_1 JLPT,OzC<9.M=Ar,"ไกลแสนไกล สถานที่ห่างไกล, ถิ่นไกล, ที่ห่างไกล, ต่างถิ่น"
円満,えんまん,"harmony, peace, smoothness",JLPT_1 JLPT,Ct:pLi;{3A,"ความกลมกลืน ความสงบ ความราบรื่น, ความเรียบร้อย, ความลงตัว, สงบสุข"
追い込む,おいこむ,"to herd, to corner, to drive",JLPT_1 JLPT,AR1qUDM@P),"ต้อน, ต้อนเข้ามุม, ขับไล่, บีบเข้ามุม"
追い出す,おいだす,"to expel, to drive out",JLPT_1 JLPT,"riRN3`p,`k","ขับไล่, ไล่ออกไป, ขับออก, เนรเทศ"
於いて,おいて,"at, in, on",JLPT_1 JLPT,ijyE>WQ}KT,"ที่ ใน บน, ณ, ซึ่งเป็นที่, ยัง"
老いる,おいる,"to age, to grow old",JLPT_1 JLPT,Fq*tJ8V7V$,"แก่ชราลง, ชราภาพ, แก่ตัวลง, อายุมากขึ้น"
応急,おうきゅう,emergency,JLPT_1 JLPT,P7w*v4FZJr,"ภาวะฉุกเฉิน, เหตุฉุกเฉิน, กรณีฉุกเฉิน, เร่งด่วน"
黄金,おうごん,gold,JLPT_1 JLPT,mYt_k*xkZ.,"ทอง, ทองคำ, สุวรรณ, กนก"
往診,おうしん,"doctor's visit, house call",JLPT_1 JLPT,KYeqnnZ=-9,"การไปพบแพทย์ การไปตรวจที่บ้าน, เยี่ยมไข้, ออกตรวจที่บ้าน, ตรวจนอกสถานที่"
応募,おうぼ,"subscription, application",JLPT_1 JLPT,b[VDDlfAs0,"การสมัครสมาชิก การสมัคร, การยื่นใบสมัคร, การลงทะเบียน, สมัครเข้าร่วม"
おおい (かん),おおい (かん),hey,JLPT_1 JLPT,"oI,HaDOI/S","เฮ้, โว้ย, หวัดดี, ทักทาย"
大方,おおかた,"almost all, majority",JLPT_1 JLPT,xJaUka+CN:,"เกือบทั้งหมด ส่วนใหญ่, ส่วนมาก, แทบทั้งหมด, โดยทั่วไป"
大柄,おおがら,"large build, large pattern",JLPT_1 JLPT,"GWS,d=cM(:","โครงสร้างขนาดใหญ่ ลวดลายขนาดใหญ่, รูปร่างใหญ่, ลายใหญ่, ตัวใหญ่"
おおげさ,おおげさ,"grandiose, exaggerated",JLPT_1 JLPT,oddUsiCw^V,"โอ้อวด เกินจริง, ใหญ่โต, เกินเลย, พูดยกเมฆ"
大筋,おおすじ,"outline, summary",JLPT_1 JLPT,Hs`P|H+T!],"โครงร่าง, สรุป, สาระสำคัญ, หัวข้อหลัก"
大空,おおぞら,"heaven, the sky",JLPT_1 JLPT,x&4e(F[|Hd,"สวรรค์ ท้องฟ้า, อากาศ, นภากาศ, เวหา"
オートマチック,オートマチック,automatic,JLPT_1 JLPT,Ma<]_+LJWL,"อัตโนมัติ, โดยอัตโนมัติ, ระบบอัตโนมัติ, ทำงานเอง"
大幅,おおはば,"full width, large scale, drastic",JLPT JLPT_1 MediaMissing,c`*FbFL7!*,"ความกว้างเต็ม, ขนาดใหญ่, อย่างมาก, อย่างยิ่งใหญ่"
おおまかな,おおまかな,"rough, approximate",JLPT_1 JLPT,h|xK)[LK#`,"คร่าวๆ โดยประมาณ, ประมาณการ, ไม่ละเอียด, โดยสังเขป"
大水,おおみず,flood,JLPT_1 JLPT,lHnH3YrPE%,"น้ำท่วม, อุทกภัย, น้ำหลาก, น้ำล้น"
公,おおやけ,public,JLPT_1 JLPT,oI.<`;>b`b,"สาธารณะ, ส่วนรวม, ทั่วไป, เปิดเผย"
犯す,おかす,"to perpetrate, to violate",JLPT_1 JLPT,r}qWP|]B{j,"กระทำการ, ละเมิด, ก่ออาชญากรรม, ทำผิด"
侵す,おかす,"to invade, to raid, to trespass",JLPT_1 JLPT,JP!&.Z9_)1,"บุกรุก, ปล้น, ล่วงล้ำ, รุกราน"
臆病,おくびょう,"cowardice, timidity",JLPT_1 JLPT,DR9F4{>w8i,"ความขี้ขลาด ความหวาดกลัว, ความขลาดกลัว, ความไม่กล้า, ขี้กลัว"
遅らす,おくらす,"to retard, to delay",JLPT_1 JLPT,BxX=0Td:Ra,"ชะลอ, ทำให้ล่าช้า, หน่วงเหนี่ยว, ยืดเวลา"
厳か,おごそか,"majestic, dignified",JLPT_1 JLPT,k^}q{Z*:ZU,"สง่างาม ภูมิฐาน, ยิ่งใหญ่, สมสง่า, เคร่งขรึม"
行い,おこない,"conduct, behavior, action",JLPT_1 JLPT,EPt}Y|moZw,"การกระทำ พฤติกรรม การกระทำ, การประพฤติ, ความประพฤติ, การปฏิบัติ"
おごる (ゆうしょくを～),おごる (ゆうしょくを～),to give (someone) a treat,JLPT_1 JLPT,nplO^(LG?d,"ให้ (ใครบางคน) ของกินเล่น, เลี้ยงอาหาร, เลี้ยงฉลอง, ซื้อให้"
収まる,おさまる,to settle into; to be obtained,JLPT_1 JLPT,blHU8/+m@I,"ตั้งรกราก; ได้รับมา, เข้าที่, สงบลง, ได้มา"
納まる,おさまる,to settle into; to be obtained,JLPT_1 JLPT,cv8FX+R{$0,"ตั้งรกราก; ได้รับมา, อยู่ตัว, บรรลุผล, คลี่คลาย"
治まる,おさまる,"to be at peace, to calm down",JLPT_1 JLPT,vn/~]L;$eG,"เพื่อความสงบ เพื่อผ่อนคลาย, สงบลง, คลี่คลาย, ระงับ"
お産,おさん,(giving) birth,JLPT_1 JLPT,euz]Ka!XAe,"(การให้กำเนิด), การคลอดบุตร, การออกลูก, การเกิด"
押し切る,おしきる,to have one's own way,JLPT_1 JLPT,djU<$hJj6~,"ทำตามใจตัวเอง, เอาชนะ, บังคับ, ดื้อรั้น"
押し込む,おしこむ,"to push into, to crowd into",JLPT_1 JLPT,xrb|Hb|isj,"ผลักเข้าไป, เบียดเข้าไป, ดันเข้าไป, อัดเข้าไป"
惜しむ,おしむ,"to be frugal, to value, to regret",JLPT_1 JLPT,eSj?}z3f2/,"ประหยัด, เห็นคุณค่า, รู้สึกเสียใจ, อาลัย"
押し寄せる,おしよせる,"to push aside, to advance on",JLPT_1 JLPT,G6S^.J|&^/,"ผลักออกไป, รุกคืบไปข้างหน้า, ผลักดัน, รุกเข้าหา"
雄,おす,male (animal),JLPT_1 JLPT,gZ*7YqB0w(,"เพศผู้ (สัตว์), ตัวผู้, สัตว์เพศผู้, ชาย"
御世辞,おせじ,"flattery, compliment",JLPT_1 JLPT,d$tF`<~=wO,"คำเยินยอ คำชม, ยกยอ, ปากหวาน, ชมเชย"
襲う,おそう,to attack,JLPT_1 JLPT,d*HJIF;zrC,"เพื่อโจมตี, โจมตี, จู่โจม, เข้าตี"
遅くとも,おそくとも,at the latest,JLPT_1 JLPT,"p,08OPe)d%","อย่างช้าที่สุด, อย่างน้อยที่สุด, ช้าสุด, ไม่เกิน"
恐れ,おそれ,"fear, horror",JLPT_1 JLPT,mG1{:BxE;,"ความกลัว ความสยดสยอง, ความน่าสะพรึงกลัว, ความครั่นคร้าม, ความขยาด"
恐れ入る,おそれいる,"to be filled with awe, to feel small",JLPT_1 JLPT,o7$@i&/e=j,"รู้สึกทึ่งจนแทบขยับเขยื้อน, เกรงใจ, ทึ่ง, ประทับใจ"
おだてる,おだてる,to flatter,JLPT_1 JLPT,"c}qANB`J7,","เพื่อประจบประแจง, ยกยอ, ป้อยอ, เยินยอ"
落ち込む,おちこむ,to get depressed,JLPT_1 Genki_Ln.16 JLPT Genki,B0Aq~FM[^o,"เป็นโรคซึมเศร้า, เศร้าซึม, หดหู่, ท้อแท้"
落ち着き,おちつき,"calm, composure",JLPT_1 JLPT,"k)L1,/cgqd","สงบเยือกเย็น, ความสงบ, ความเยือกเย็น, มีสติ"
落葉,おちば,fallen leaves,JLPT_1 JLPT,qPS6$v<zNn,"ใบไม้ร่วง, ใบไม้แห้ง, ใบไม้หล่น, ซากใบไม้"
乙,おつ,2nd in rank,JLPT_1 JLPT,"CTIZFIH,kM","อันดับที่ 2, ลำดับที่สอง, รองจาก, ถัดไป"
お使い,おつかい,errand,JLPT_1 JLPT,"Q3Uu~eV;,,","ธุระ, กิจธุระ, ภารกิจ, งานเล็กๆ"
おっかない,おっかない,"frightening, scary",JLPT_1 JLPT,r<$W[mdg(3,"น่ากลัว น่าหวาดเสียว, น่าสะพรึงกลัว, สยอง, ขนลุก"
お手上げ,おてあげ,"given in, given up hope",JLPT_1 JLPT,J({SY<_/!4,"ยอมแพ้ หมดหวัง, ยอมจำนน, สิ้นหวัง, ล้มเลิก"
おどおど,おどおど,"coweringly, hesitantly",JLPT_1 JLPT,hFdj&!1iUO,"ด้วยความหวาดกลัวและลังเล, กล้าๆ กลัวๆ, ประหม่า, เก้อเขิน"
脅す,おどす,"to threaten, to menace",JLPT_1 JLPT,l9J?^6gNw8,"ข่มขู่ คุกคาม, ขู่เข็ญ, ขู่กรรโชก, บังคับ"
訪れる,おとずれる,to visit,JLPT_1 JLPT,M;`!*}::|V,"เพื่อเยี่ยมชม, เยี่ยมเยียน, แวะเยี่ยม, ไปหา"
お供,おとも,"attendant, companion",JLPT_1 JLPT,x[kh8D~cRx,"ผู้ติดตาม, เพื่อนร่วมทาง, บริวาร, คนสนิท"
衰える,おとろえる,"to become weak, to decline",JLPT_1 JLPT,pxXWt`7[Xh,"อ่อนแอลง, เสื่อมถอยลง, ทรุดโทรม, ถดถอย"
同い年,おないどし,of the same age,JLPT_1 JLPT,uOL4]ka~4C,"ที่มีอายุเท่ากัน, รุ่นเดียวกัน, อายุเท่ากัน, เพื่อนรุ่นเดียวกัน"
自ずから,おのずから,"naturally, as a matter of course",JLPT_1 JLPT,CsPmT^E4si,"โดยธรรมชาติ เป็นเรื่องปกติอยู่แล้ว, โดยเนื้อแท้, ตามปกติ, อย่างแน่นอน"
怯える,おびえる,to become frightened,JLPT_1 JLPT,Bil>aIK.P>,"กลัวจนตัวสั่น, หวาดกลัว, ตกใจ, สะท้าน"
おびただしい,おびただしい,"abundantly, innumerably",JLPT_1 JLPT,F0E@v8v<tK,"มากมาย นับไม่ถ้วน, เยอะแยะ, อักโข, ล้นหลาม"
脅かす,おびやかす,"to threaten, to coerce",JLPT_1 JLPT,y}AqB/U_jH,"ข่มขู่ บังคับ, คุกคาม, ก่อกวน, ทำให้หวาดกลัว"
帯びる,おびる,"to bear, to carry, to be entrusted",JLPT_1 JLPT,zXZ(?*QD)1,"แบกรับ, ถือ, ได้รับมอบหมาย, รับผิดชอบ"
お袋,おふくろ,mother,JLPT_1 JLPT,Iky=(#jNrr,"แม่, มารดา, มาตุ, แม่ผู้ให้กำเนิด"
覚え,おぼえ,"memory, sense, experience",JLPT_1 JLPT,z/W-oJ8vaW,"ความทรงจำ สัมผัส ประสบการณ์, ความจำ, การเรียนรู้, การรับรู้"
おまけ,おまけ,a discount; something additional,JLPT_1 JLPT,rsBcP;b`Jp,"ส่วนลด; สิ่งเพิ่มเติม, ของแถม, แถมให้, เพิ่มพิเศษ"
お宮,おみや,Shinto shrine,JLPT_1 JLPT,COvUCQv?BW,"ศาลเจ้าชินโต, เทวสถาน, ที่สถิตเทพเจ้า, สถานศักดิ์สิทธิ์"
おむつ,おむつ,"diaper, nappy",JLPT_1 JLPT,FRkuxmL~/i,"ผ้าอ้อม, ผ้าอ้อมเด็ก, แผ่นซับ, ผ้าอ้อมสำเร็จรูป"
思い付き,おもいつき,"plan, idea, suggestion",JLPT_1 JLPT,gk=p@=>B|;,"แผน, แนวคิด, ข้อเสนอแนะ, ความบันดาลใจ"
趣,おもむき,"flavor, appearance, quaint",JLPT_1 JLPT,o+otz^p(oN,"รสชาติ รูปลักษณ์ ความแปลกตา, ลักษณะพิเศษ, สไตล์, เสน่ห์"
赴く,おもむく,"to go, to proceed",JLPT_1 JLPT,E5WffQ+ViL,"ไป, ดำเนินการต่อไป, มุ่งหน้า, ตรงไป"
重んじる,おもんじる,"to respect, to honor, to esteem, to prize",JLPT_1 JLPT,"gj_$ok,;mR","เพื่อเคารพ เพื่อยกย่อง เพื่อนับถือ เพื่อชื่นชม, ให้เกียรติ, ให้ความสำคัญ, ยึดถือ"
重んずる,おもんずる,"to honor, to respect, to value",JLPT_1 JLPT,c;eXv;e7cc,"เพื่อเป็นเกียรติ เพื่อแสดงความเคารพ เพื่อให้คุณค่า, นับถือ, เห็นคุณค่า, ให้เกียรติ"
親父,おやじ,"one's father, old man, one's boss",JLPT_1 JLPT,g;f)J>kju#,"พ่อ, ชายชรา, เจ้านาย, เถ้าแก่"
及び,および,"and, as well as",JLPT_1 JLPT,"F5z-<*3Tg,","และรวมถึง, กับ, พร้อมทั้ง, และอื่นๆ"
